image,name,cost,text,set,rarity,type,supertype,subtype,subtype2
 TOTEM-DE-ESPIRITU-ANIMAL,TOTEM DE ESPIRITU ANIMAL,1,Una vez durante tu turno puedes erosionar para crear una ficha animal 1/1. Erosión 3.,PACTO SECRETO,PLATA,MONUMENTO,-,-,-
 TRAMPA-DE-ESPINAS,TRAMPA DE ESPINAS,1,Destruir: Hasta tres unidades objetivo sin Evasión no puedan atacar este turno.,PACTO SECRETO,BRONCE,MONUMENTO,-,-,-
 TRIPULACION-EN-CAMINO,TRIPULACION EN CAMINO,3,Busca en tu Reino dos cartas de unidad de coste 2 o menos y juégalas sin pagar su coste. Esas órdenes no pueden ser interrumpidas.,FUNDAMENTOS,ORO,ACCION,-,RAPIDA,-
 UNION-DE-BRUJAS,UNION DE BRUJAS,2,Interrumpe la orden de acción objetivo.,PACTO SECRETO,BRONCE,ACCION,-,RAPIDA,-
 URLAMOK_GUARDIAN_DEL_ORO_COPIA,"URLAMOK, GUARDIAN DEL ORO",7,Ininterrumpible. Evasión. Guardián. Resguardo: 2 de oro. Aparición en juego: Elige 2: -Crea una ficha espíritu 5/5 con Arrollar. -Naturaliza la unidad o tesoro rival objetivo. -Ganas 7 vidas. -Roba una carta.,TRONO COMPARTIDO,DIAMANTE,UNIDAD,-,ELEMENTAL,DRAGON
 VENGANZA_DE_ERODON_COPIA,VENGANZA DE ERODON,5,Condena las unidades con contadores.,TRONO COMPARTIDO,PLATA,ACCION,-,RAPIDA,-
 VERDUGO_INFERNAL_COPIA,VERDUGO INFERNAL,1,Aparición en juego: Condena la carta de unidad objetivo de un Descarte.,TRONO COMPARTIDO,BRONCE,UNIDAD,-,DEMONIO,-
 VIDENTE-DEL-BOSQUE,VIDENTE DEL BOSQUE,2,"Predicción 1. Durante tu turno, Destruir: Roba una carta.",PACTO SECRETO,BRONCE,UNIDAD,-,BRUJA,-
 VIDENTE-EFECTIVA,VIDENTE EFECTIVA,1,"Predicción 2. (Mira las primeras X cartas de tu Reino, dónde X es el número de Predicción, luego pon cualquier cantidad en la parte superior y el resto en el fondo).",PACTO SECRETO,BRONCE,UNIDAD,-,BRUJA,-
 VIGILANTE_DEL_PORTAL_COPIA,VIGILANTE DEL PORTAL,2,Aparición en juego: Cada jugador condena una carta de su mano.,TRONO COMPARTIDO,PLATA,UNIDAD,-,DEMONIO,-
 VINO_VIGOTIZANTE_COPIA,VINO VIGORIZANTE DE MONJE,0,Agotar: Remueve hasta un contador de la unidad objetivo.,TRONO COMPARTIDO,PLATA,TESORO,-,COMUN,-
 VOLUNTARIO_PARA_SACRIFICIO_COPIA,VOLUNTARIO PARA SACRIFICIO,4,Derrotado: Crea una ficha ángel 3/3 con Evasión.,TRONO COMPARTIDO,BRONCE,UNIDAD,-,MONJE,-
 VOLVIENDO_DEL_PASEO,VOLVIENDO DEL PASEO,1,"Reaparece la unidad objetivo. Si controlas un monje, ganas 2 vidas.",TRONO COMPARTIDO,BRONCE,ACCION,-,RAPIDA,MONJE
